{
  "schema_version": "signalforge/golden-price-set/v1",
  "dataset_id": "nasdaq-official-close-2026-07-20",
  "retrieved_at": "2026-07-22T02:06:50Z",
  "prices": [
    {
      "ticker": "MSFT",
      "value": "402.29",
      "currency": "USD",
      "as_of": "2026-07-20T20:00:00Z",
      "source": "https://api.nasdaq.com/api/quote/MSFT/historical?assetclass=stocks&fromdate=2026-07-20&todate=2026-07-21&limit=10",
      "source_sha256": "eb495fa8f5c6971843f4067ec56e6b099107e7a9876f3a5b732faba698189c51"
    },
    {
      "ticker": "NVDA",
      "value": "203.28",
      "currency": "USD",
      "as_of": "2026-07-20T20:00:00Z",
      "source": "https://api.nasdaq.com/api/quote/NVDA/historical?assetclass=stocks&fromdate=2026-07-20&todate=2026-07-21&limit=10",
      "source_sha256": "b4cfe80908cc2259e19599301fc19f9a76179676bccdf5cd7a9f213238dbd20d"
    }
  ]
}
